{
  "type": "loom-agent-run-v1",
  "job_id": "run-fixture-replay-0001",
  "request_hash": "sha256:request-fixture-replay-hash",
  "mode": "prompt-run",
  "parent_state": {
    "state_id": "state-root-replay-0001",
    "bundle_sha256": "sha256:bundle-parent-replay-hash",
    "ratchet_step": 1
  },
  "result": {
    "response_sha256": "sha256:response-fixture-replay-hash",
    "response_locator": "local://runs/run-fixture-replay-0001/result.json",
    "new_state": {
      "state_id": "state-child-replay-0001",
      "bundle_sha256": "sha256:bundle-child-replay-hash",
      "bundle_manifest_sha256": "sha256:manifest-child-replay-hash"
    }
  },
  "runtime": {
    "workflow_ref": "owner/repo/.github/workflows/swarm-run.yml@0123456789abcdef0123456789abcdef01234567",
    "runner_class": "github-hosted",
    "started_at": "2026-02-28T12:00:10Z",
    "finished_at": "2026-02-28T12:00:20Z"
  },
  "replay": {
    "nonce": "nonce-replay-fixture-0001",
    "expires_at_unix": 1893456000
  },
  "timestamp": "2026-02-28T12:00:20Z"
}
